Issue Number,Alarm Severity,Status,Event Title,Airtel Site ID,ISM,ATC ID,Cluster,Regional Manager,Alarm Start Time,Alarm Cleared Time,DURATION,MTTR,MTTR RANGE,Root Cause,Specific Cause,Underlying Cause,Closing Details,Site Issue Type,ATC CLASS,AIRTEL CLASS,AIRTEL REGION,key
28378566,Closed,Major,SITE DOWN AT KB0415,KB0415,I-ENG,626796,Yauri,John  Adejo,03/07/2024 00:07,03/07/2024 01:53,105.99999999976716,1.7666666666627862,<2hrs,Power,Theft,Fuel Theft,"DIESEL THEFT AT SITE, IT WAS TOPPED AND DG POWERED_x000D_
DL  445   RH  12111",Incident,Silver,Silver,NORTH WEST,28378566_2024-07-03 00:07:00
28380680,Closed,Major,SITE DOWN@AB0699,AB0699,I-ENG,628487,Apo,Uche Obasi,03/07/2024 00:00,03/07/2024 05:26,326.0000000044238,5.433333333407063,>4hrs,Power,Fuel Outage,Low Fuel,LOW DIESEL LEVEL//DIESEL WAS TOPPED AND DG POWERED/NO GALOOLI AT SITE,Incident,Silver,Silver,NORTH WEST,28380680_2024-07-03 00:00:00
28378646,Closed,Major,SITE DOWN AT KG0176,KG0176,I-ENG,627966,Ayangba,Uche Obasi,03/07/2024 00:00,03/07/2024 00:15,14.99999999650754,0.2499999999417923,<2hrs,Power,DC Power,Rectifier Fault|Module Fault,"FAULTY DG MODULE  WAS WORKED ON, DG POWERED",Incident,Silver,Silver,NORTH WEST,28378646_2024-07-03 00:00:00
28378316,Closed,Major,SITE DOWN AT SK0414,SK0414,I-ENG,409312,Jega,John  Adejo,03/07/2024 00:00,03/07/2024 02:34,153.99999999906868,2.5666666666511446,2hrs - 4hrs,Power,DG Fault,Generator Failure,WEAK DG WAS PRIMED TO START,Incident,Platinum COLO,Silver,NORTH WEST,28378316_2024-07-03 00:00:00
28379796,Closed,Major,SITE DOWN AT NI0512,NI0512,I-ENG,408301,Minna 2,Yusuf Abdullahi,03/07/2024 00:00,03/07/2024 01:14,74.00000000023283,1.2333333333372138,<2hrs,Power,DG Fault,Generator Fault,"WEAK DG WAS PRIMED TO START_x000D_
DL  561  RH  21011",Incident,Platinum COLO,Silver,NORTH WEST,28379796_2024-07-03 00:00:00
28377874,Closed,Major,SITE DOWN AT KG0334,KG0334,I-ENG,406914,Lokoja,Uche Obasi,03/07/2024 00:00,03/07/2024 00:44,43.99999999674037,0.7333333332790062,<2hrs,Power,Fuel Outage,Low Fuel,LOW DEISEL LEVEL// DIESEL WAS TOPPED AND DG POWERED,Incident,Platinum COLO,Silver,NORTH WEST,28377874_2024-07-03 00:00:00
28377219,Closed,Major,SITE DOWN AT KN0022_MTN,KN0022,I-ENG,402421,Sabon Gari,Usman Shaibu,03/07/2024 00:00,03/07/2024 00:37,36.999999994877726,0.6166666665812954,<2hrs,Power,DG Fault,Faulty Priming Pump,"FAULTY INJECTOR PUMP WAS WORKED ON_x000D_
DL  445  RH  12110",Incident,Platinum COLO,Gold,NORTH EAST,28377219_2024-07-03 00:00:00
28376260,Closed,Major,SITE DOWN AT AB0032,AB0032,I-ENG,400025,Kubwa,Uche Obasi,03/07/2024 00:00,03/07/2024 00:15,14.99999999650754,0.2499999999417923,<2hrs,Power,DG Fault,Water Pump Fault,FAULTY LIFT PUMP WAS WORKED ON,Incident,Platinum COLO,Silver,NORTH WEST,28376260_2024-07-03 00:00:00
28431868,Closed,Major,SITE DOWN AT KN0308,KN0308,I-ENG,402544,Kano 6,Usman Shaibu,04/07/2024 23:53,04/07/2024 23:59,6.983333331299946,0.1163888888549991,<2hrs,Power,DG Fault,Oil pressure Switch Fault,"LOW OIL PRESSURE, OIL WAS TOPPED DL 877 RH 14931",Incident,Silver,Silver,NORTH EAST,28431868_2024-07-04 23:53:00
28431295,Closed,Major,SITE DOWN AT KG0086,KG0086,I-ENG,402370,Lokoja,Uche Obasi,04/07/2024 22:55,04/07/2024 23:59,64.98333333,1.0830555555294268,<2hrs,Power,Theft,AC/DC Cable Theft,"VANDALIZED ARMOURED CABLES FROM DG TO RECTIFIER WAS REPLACED, RH: 4639",Security,Platinum,Platinum,NORTH WEST,28431295_2024-07-04 22:55:00
28430476,Closed,Major,SITE DOWN AT KN0054,KN0054-Z,I-ENG,407580,Kano 4,Usman Shaibu,04/07/2024 21:39,04/07/2024 22:15,36.00000000209548,0.6000000000349246,<2hrs,Power,DG Fault,Hybrid Fault,"HYBRID SYNC. DUE TO DG FAILED TO START ALARM, ALARM WAS CLEARED AND DG POWERED DL 977 RH 4442",Incident,Silver,Silver,NORTH EAST,28430476_2024-07-04 21:39:00
28430424,Closed,Major,SITE DOWN AT KN0912,KN0912,I-ENG,627921,Gumel,Usman Shaibu,04/07/2024 21:34,04/07/2024 23:59,145.98333333386108,2.4330555555643514,2hrs - 4hrs,Power,DG Fault,DG Coolant low,"DG HIGH TEMP. DUE TO LOW WATER IN THE RADIATOR, WATER WAS TOPPED DL 371 RH 5780",Incident,Silver,Silver,NORTH EAST,28430424_2024-07-04 21:34:00
28430146,Closed,Major,SITE DOWN AT NI0072,NI0072,I-ENG,403458,Minna 1,Yusuf Abdullahi,04/07/2024 21:31,04/07/2024 22:43,72.00000000419095,1.2000000000698492,<2hrs,Power,DG Fault,Hybrid Exit Failure,"HYBRID SYNC. FAILURE DUE TO DG FAILED TO START ALARM, ALARM WAS CLEARED AND DG POWERED DL 284 RH 2831",Incident,Gold,Gold,NORTH WEST,28430146_2024-07-04 21:31:00
28430659,Closed,Major,SITE DOWN AT KD0895,KD0895,I-ENG,409089,Kafanchan 1,Emmanuel Okolo,04/07/2024 21:24,04/07/2024 22:50,85.99999999743886,1.4333333332906475,<2hrs,Power,DG Fault,Faulty Control Panel,FAULTY DG MODULE WAS WORKED ON,Incident,Platinum COLO,Silver,NORTH WEST,28430659_2024-07-04 21:24:00
28429678,Closed,Major,SITE DOWN AT KN0087,KN0087,I-ENG,402484,Rano,Usman Shaibu,04/07/2024 21:09,04/07/2024 21:35,26.000000000931323,0.4333333333488554,<2hrs,Power,DG Fault,DG Coolant low,"DG HIGH TEMP. DUE TO LOW IN THE RADIATOR, WATER WAS TOPPED DL 956 RH 8152",Incident,Silver,Silver,NORTH EAST,28429678_2024-07-04 21:09:00
28430350,Closed,Major,SITE DOWN AT KN0297,KN0297,I-ENG,402424,Kano 2,Usman Shaibu,04/07/2024 21:06,04/07/2024 21:50,43.99999999674037,0.7333333332790062,<2hrs,Power,DG Fault,DG Coolant low,"DG HIGH TEMP. DUE TO LOW WATER LEVEL, WATER WAS TOPPED DL 1774 RH 13118",Incident,Platinum COLO,Silver,NORTH EAST,28430350_2024-07-04 21:06:00
28428412,Closed,Major,SITE DOWN AT KD0302,KD0302,I-ENG,402251,Zaria 2,Emmanuel Okolo,04/07/2024 19:39,04/07/2024 21:53,134.00000000721775,2.233333333453629,2hrs - 4hrs,Power,DG Fault,Faulty DG Contactor,"FAULTY GAVE CONTACTOR WAS WORKED ON : 2701DL , 16163RH",Incident,Silver,Silver,NORTH WEST,28428412_2024-07-04 19:39:00
28428484,Closed,Major,SITE DOWN AT KB0025,KB0025,I-ENG,402093,Koko,John  Adejo,04/07/2024 19:01,04/07/2024 20:20,78.99999999557622,1.316666666592937,<2hrs,Power,DC Power,AC Breaker Fault|Tripped ACDB Breaker,POWER FAILED FROM HIGH PRIORITY CABLE WAS TECHNICAL RESOLVED DL 1468 RH 19249,Incident,Platinum,Platinum,NORTH WEST,28428484_2024-07-04 19:01:00
28426624,Closed,Major,SITE DOWN@KN0106,KN0106,I-ENG,402493,Kano 4,Usman Shaibu,04/07/2024 18:45,04/07/2024 18:55,10.000000001164151,0.1666666666860692,<2hrs,Power,DG Fault,DG Coolant low,"FSE UMARU CONFIRMED HIGH TEMP ON DG DUE TO LOW WATER LEVEL IN RADIATOR, RADIATOR FLUSHED AND WATER WAS ADDED_x000D_
DL:1340_x000D_
GHR:12484",Incident,Platinum COLO,Silver,NORTH EAST,28426624_2024-07-04 18:45:00
28426914,Closed,Major,SITE DOWN@NI0014,NI0014,I-ENG,403410,Minna 2,Yusuf Abdullahi,04/07/2024 18:45,04/07/2024 19:48,62.99999999580905,1.0499999999301508,<2hrs,Power,Fuel Outage,Low Fuel,"LOW DIESEL, DIESEL WAS TOPPED DL 931 RH 434",Incident,Silver,Silver,NORTH WEST,28426914_2024-07-04 18:45:00
28424632,Closed,Major,SITE DOWN@KN0049,KN0049,I-ENG,402447,Hotoro,Usman Shaibu,04/07/2024 17:25,04/07/2024 18:36,71.00000000093132,1.1833333333488554,<2hrs,Power,DG Fault,Generator Fault,"FSE ISAAC CONFIRMED FAULTY DG MODULE, IT WAS WORKED ON_x000D_
DL:1257_x000D_
GRH:6145",Incident,Platinum COLO,Gold,NORTH EAST,28424632_2024-07-04 17:25:00
28418158,Closed,Major,SITE DOWN @ KD0431,KD0431,I-ENG,402283,Kaduna North,Emmanuel Okolo,04/07/2024 12:44,04/07/2024 12:54,10.000000001164151,0.1666666666860692,<2hrs,Power,DG Fault,DG Electric Fuel Pump,FAULTY  INJECTOR PUMP WAS SERVICED (214L) (8506RH),Incident,Platinum COLO,Silver,NORTH WEST,28418158_2024-07-04 12:44:00
28414279,Closed,Major,SITE DOWN @  KG0315,KG0315,I-ENG,402397,Ayangba,Uche Obasi,04/07/2024 08:20,04/07/2024 08:43,23.00000000162981,0.3833333333604969,<2hrs,Power,DG Fault,DG Electric Fuel Pump,"FAULTY INJECTOR PUMP WAS WORKED ON (1551L), (7779RH)",Incident,Platinum COLO,Platinum,NORTH WEST,28414279_2024-07-04 08:20:00
28407410,Closed,Major,SITE DOWN@KN0248,KN0248,I-ENG,402530,Kano 5,Usman Shaibu,04/07/2024 04:56,04/07/2024 05:09,13.00000000046566,0.2166666666744277,<2hrs,Power,DC Power,LIB Fault|Faulty LIBs,FAULTY LIB ALARM WAS CLEARED AND DG POWERED,Incident,Silver,Silver,NORTH EAST,28407410_2024-07-04 04:56:00
28407372,Closed,Major,SITE DOWN AT ZM0421,ZM0421,I-ENG,627320,Gusau,Ibrahim Lawan,04/07/2024 04:56,04/07/2024 05:59,62.99999999580905,1.0499999999301508,<2hrs,Power,DG Fault,Faulty Fuel Solenoid,FAULTY SOLENIOD SWITCH WAS BYPASSED,Incident,Platinum COLO,Silver,NORTH WEST,28407372_2024-07-04 04:56:00
28407360,Closed,Major,SITE DOWN AT AB0063,AB0063,I-ENG,400045,CBD,Uche Obasi,04/07/2024 04:32,04/07/2024 12:28,476.0000000009313,7.933333333348855,>4hrs,Power,DG Fault,DG Alternator fault,"FAULTY MAIN ALTERNATOR WAS REPLACED AND DG POWERED  (381L), (4037RH)",Incident,Silver,Silver,NORTH WEST,28407360_2024-07-04 04:32:00
28407330,Closed,Major,SITE DOWN AT KB0416,KB0416,I-ENG,626201,Kebbi Metro,John  Adejo,04/07/2024 04:15,04/07/2024 06:14,119.00000000023284,1.9833333333372136,<2hrs,Power,DG Fault,DG Starter Battery Fault,"FLAT DG BATTERY , EXTERNAL BATTERY WAS USED TO POWER DG",Incident,Silver,Silver,NORTH WEST,28407330_2024-07-04 04:15:00
28406755,Closed,Major,SITE DOWN@KN0106,KN0106,I-ENG,402493,Kano 4,Usman Shaibu,04/07/2024 03:53,04/07/2024 04:09,15.99999999976717,0.2666666666627861,<2hrs,Power,DG Fault,DG Coolant low,"DG HIGH  TEMP DUE TO LOW WATER LEVEL,RADIATOR WAS FLUSHED AND  WATER WAS TOPPED _x000D_
DL 1392  RH  12474",Incident,Platinum COLO,Silver,NORTH EAST,28406755_2024-07-04 03:53:00
28406623,Closed,Major,SITE DOWN AT NI0064,NI0064,I-ENG,403450,Kontagora2,Yusuf Abdullahi,04/07/2024 03:44,04/07/2024 04:07,23.00000000162981,0.3833333333604969,<2hrs,Power,DG Fault,DG Coolant low,"DG HIGH  TEMP DUE TO LOW WATER LEVEL,RADIATOR WAS FLUSHED AND  WATER WAS TOPPED",Incident,Platinum COLO,Gold,NORTH WEST,28406623_2024-07-04 03:44:00
28406820,Closed,Major,SITE DOWN AT AB0063,AB0063,I-ENG,400045,CBD,Uche Obasi,04/07/2024 03:32,04/07/2024 04:12,40.00000000465661,0.6666666667442769,<2hrs,Power,DG Fault,Rectifier Fault|Overload,"VOLTAGE FLUTUATION DUE TO DG OVERLOAD, LOAD WAS ADJUSTED",Incident,Silver,Silver,NORTH WEST,28406820_2024-07-04 03:32:00
28406593,Closed,Major,SITE DOWN@KN0940,KN0940,I-ENG,627838,Kano 2,Usman Shaibu,04/07/2024 03:09,04/07/2024 04:24,75.00000000349246,1.2500000000582077,<2hrs,Power,DG Fault,AVR Fault,"FAULTY AVR WAS WORKED ON_x000D_
DL  398  RH  10240",Incident,Platinum COLO,Silver,NORTH EAST,28406593_2024-07-04 03:09:00
28406168,Closed,Major,SITE DOWN AT KD0703,KD0703,I-ENG,628580,Kafanchan 2,Emmanuel Okolo,04/07/2024 02:43,04/07/2024 07:14,271.00000000325963,4.516666666720994,>4hrs,Power,Theft,Human inteferance,"DC CABLE THEFT CABLE CONNECTION COMPLETED FROM DB TO BTS WAS RELACED AND SITE RESTORED DL 671L , RH 3965",Incident,Silver,Silver,NORTH WEST,28406168_2024-07-04 02:43:00
28405961,Closed,Major,SITE DOWN AT KN0224+3,KN0224,I-ENG,402512,Bichi,Usman Shaibu,04/07/2024 02:06,04/07/2024 02:50,43.99999999674037,0.7333333332790062,<2hrs,Power,DG Fault,Fuel System Fault,"FUEL LINE  BLOCKAGE WAS CLEARED_x000D_
DL  628  RH  1856",Incident,Silver,Silver,NORTH EAST,28405961_2024-07-04 02:06:00
28405199,Closed,Major,SITE DOWN AT JG0456,JG0456,I-ENG,627121,Hadeija,Usman Shaibu,04/07/2024 01:11,04/07/2024 06:17,306.0000000020955,5.100000000034925,>4hrs,Power,DG Fault,DG AC Alternator fault,"FAULTY MAIN ALTERNATOR, BUB WAS DEPLOYED",Incident,Silver,Silver,NORTH EAST,28405199_2024-07-04 01:11:00
28404706,Closed,Major,SITE DOWN AT KG0206,KG0206,I-ENG,402374,Idah,Uche Obasi,04/07/2024 00:03,04/07/2024 07:32,448.9999999967404,7.483333333279006,>4hrs,Power,DG Fault,Engine Failure,"High Risk Area/Faulty AVR and it was bypassed pending replacement DL 381L , RH 17109",Incident,Silver,Silver,NORTH WEST,28404706_2024-07-04 00:03:00
28403870,Closed,Major,SITE DOWN@AB0700,AB0700,I-ENG,628467,Apo,Uche Obasi,04/07/2024 00:00,04/07/2024 02:01,120.99999999627472,2.0166666666045785,2hrs - 4hrs,Power,Fuel Outage,Low Fuel,"LOW DIESEL AT SITE, DIESEL WAS TOPPED AND DG POWERED",Incident,Silver,Silver,NORTH WEST,28403870_2024-07-04 00:00:00
28457833,Closed,Major,SITE DOWN AT KG0083,KG0083,I-ENG,402367,Okene,Uche Obasi,05/07/2024 23:53,05/07/2024 23:59,6.983333331299946,0.1163888888549991,<2hrs,Power,Fuel Outage,Low Fuel,"LOW DIESEL AT SITE, DIESEL WAS TOPPED AND DG POWERED, DL : 308 , RH : 4072",Incident,Platinum,Platinum,NORTH WEST,28457833_2024-07-05 23:53:00
28457289,Closed,Major,SITE DOWN AT KN0308,KN0308,I-ENG,402544,Kano 6,Usman Shaibu,05/07/2024 23:02,05/07/2024 23:42,40.00000000465661,0.6666666667442769,<2hrs,Power,DG Fault,DG Hard Start,WEAK DG WAS PRIME TO START DL 834 RH 14943,Incident,Silver,Silver,NORTH EAST,28457289_2024-07-05 23:02:00
28457034,Closed,Major,SITE DOWN AT KG0009,KG0009,I-ENG,402280,Okene,Uche Obasi,05/07/2024 22:00,05/07/2024 23:59,119.98333333292976,1.999722222215496,2hrs - 4hrs,Power,Fuel Outage,Low Fuel,"LOW DIESEL AT SITE, DIESEL WAS TOPPED AND DG POWERED, DL : 217 , RH : 4750",Incident,Platinum COLO,Silver,NORTH WEST,28457034_2024-07-05 22:00:00
28456005,Closed,Major,SITE DOWN AT AB0078,AB0078,I-ENG,400055,CBD,Uche Obasi,05/07/2024 20:32,05/07/2024 21:57,84.99999999417923,1.416666666569654,<2hrs,Power,DC Power,Mains Fault|Low Voltages,SYNCHRONIZATION FAILURE FROM PHCN TO DG DUE TO LOW VOLTAGE FROM PHCN,Incident,Silver,Silver,NORTH WEST,28456005_2024-07-05 20:32:00
28455524,Closed,Major,SITE DOWN AT KN0087,KN0087,I-ENG,402484,Rano,Usman Shaibu,05/07/2024 20:29,05/07/2024 22:39,129.99999999417923,2.166666666569654,2hrs - 4hrs,Power,DC Power,LIB Fault|Tripped LIB Breakers,"LIB BATTERY ALARM, ALARM WAS CLEARED DL 926 RH 8165",Incident,Silver,Silver,NORTH EAST,28455524_2024-07-05 20:29:00
28454809,Closed,Major,SITE DOWN AT NI0087,NI0087,I-ENG,403468,Kontogora1,Yusuf Abdullahi,05/07/2024 20:14,05/07/2024 23:51,217.0000000053551,3.6166666667559184,2hrs - 4hrs,Power,DG Fault,DG Fuel Filter,WATER INGRESS WAS SEPERATED DL 458 RH 10169,Incident,Silver,Silver,NORTH WEST,28454809_2024-07-05 20:14:00
28454860,Closed,Major,SITE DOWN AT KB0242,KB0242,I-ENG,402112,Koko,John  Adejo,05/07/2024 20:09,05/07/2024 20:52,42.99999999348074,0.7166666665580124,<2hrs,Power,DG Fault,DG Hard Start,"DG FAILED TO START ALARM, ALARM WAS CLEARED AND DG POWERED DL 732 RH 24747",Incident,Silver,Silver,NORTH WEST,28454860_2024-07-05 20:09:00
28455270,Closed,Major,SITE DOWN AT KG0391,KG0391,I-ENG,408209,Okene,Uche Obasi,05/07/2024 20:02,05/07/2024 22:14,132.0000000006985,2.200000000011641,2hrs - 4hrs,Power,DG Fault,Generator Fault,"DG LOSS COMPRESSION, MDG WAS DEPLOYED TO SITE  DL : 177 , RH : 17115",Incident,Platinum COLO,Silver,NORTH WEST,28455270_2024-07-05 20:02:00
28454571,Closed,Major,SITE DOWN AT KD0454,KD0454,I-ENG,402296,Kachia Road,Emmanuel Okolo,05/07/2024 19:30,05/07/2024 22:06,155.99999999511056,2.5999999999185093,2hrs - 4hrs,Power,DG Fault,Faulty Priming Pump,"HOOKED INJECTOR PUMP WAS WORKED ON, 1838DL ; 21448RH",Incident,Platinum COLO,Silver,NORTH WEST,28454571_2024-07-05 19:30:00
28453842,Closed,Major,SITE DOWN@NI0043,NI0043,I-ENG,403407,Minna 1,Yusuf Abdullahi,05/07/2024 19:21,05/07/2024 19:38,17.0,0.283333333,<2hrs,Power,DG Fault,DG In stop Mode,"DG FAILED TO START ALARM, ARALM WAS CLEARED AND DG POWERED DL 569 RH 4918",Incident,Platinum COLO,Gold,NORTH WEST,28453842_2024-07-05 19:21:00
28453890,Closed,Major,SITE DOWN @ KG0024,KG0024,I-ENG,402328,Okene,Uche Obasi,05/07/2024 18:46,05/07/2024 20:44,117.9999999969732,1.966666667,<2hrs,Power,Fuel Outage,Low Fuel,"LOW DIESEL AT SITE, DIESEL WAS TOPPED AND DG POWERED, DL : 317 , RH : 3946",Incident,Silver,Silver,NORTH WEST,28453890_2024-07-05 18:46:00
28451691,Closed,Major,SITE DOWN@NI0280,NI0280,I-ENG,403493,Suleja,Yusuf Abdullahi,05/07/2024 17:24,05/07/2024 19:00,95.99999999860302,1.599999999976717,<2hrs,Power,DG Fault,Snapped DG Fan belt,"FSE ALISION CONFIRMED CUT FAN BELT, IT WAS REPLACED_x000D_
DL:679_x000D_
GRH:17142",Incident,Platinum COLO,Silver,NORTH WEST,28451691_2024-07-05 17:24:00
28451639,Closed,Major,SITE DOWN@NI0343,NI0343,I-ENG,403528,Tegina,Yusuf Abdullahi,05/07/2024 17:10,05/07/2024 17:51,40.99999999743886,0.6833333332906477,<2hrs,Power,DG Fault,DG In stop Mode,"DG FAILED TO START ALARM, ALARM WAS CLEARED AND DG POWERED DL972 RH 13162",Incident,Gold,Gold,NORTH WEST,28451639_2024-07-05 17:10:00
28449472,Closed,Major,SITE DOWN@NI0625,NI0625,I-ENG,626957,Bida,Yusuf Abdullahi,05/07/2024 16:44,05/07/2024 16:57,13.00000000046566,0.2166666666744277,<2hrs,Power,DG Fault,Generator Failure,"RS COSMOS CONFIRMED WEAK DG, PRIME TO START_x000D_
DL:431_x000D_
GRH:21551",Incident,Silver,Silver,NORTH WEST,28449472_2024-07-05 16:44:00
28451245,Closed,Major,SITE DOWN @ KT0021+SUB,KT0021,I-ENG,402558,Daura,Ibrahim Lawan,05/07/2024 16:16,05/07/2024 19:38,202.0000000088476,3.366666666814126,2hrs - 4hrs,Power,DG Fault,DG Electric Fuel Pump,FAULTY INJECTOR PUMP WAS WORKED ON DL 1392 RH 5966,Incident,Platinum COLO,Gold,NORTH WEST,28451245_2024-07-05 16:16:00
28451511,Closed,Major,SITE DOWN @ KG0009,KG0009,I-ENG,402280,Okene,Uche Obasi,05/07/2024 16:12,05/07/2024 19:46,213.99999999557625,3.566666666592937,2hrs - 4hrs,Power,Fuel Outage,Low Fuel,"LOW DIESEL AT SITE, DIESEL WAS TOPPED AND DG POWERED, DL : 217 , RH : 4750",Incident,Platinum COLO,Silver,NORTH WEST,28451511_2024-07-05 16:12:00
28450684,Closed,Major,SITE DOWN @ KD0064,KD0064,I-ENG,402182,Kafanchan 2,Emmanuel Okolo,05/07/2024 15:36,05/07/2024 16:38,62.0,1.033333333,<2hrs,Power,DC Power,Malfunctioning,"MALFUNCATION RECTIFIER CSU WAS RESET (575L), (11469RH)",Incident,Silver,Silver,NORTH WEST,28450684_2024-07-05 15:36:00
28449271,Closed,Major,SITE DOWN@KN0735,KN0735,I-ENG,408188,Janguza,Usman Shaibu,05/07/2024 15:26,05/07/2024 16:15,49.00000000256114,0.8166666667093523,<2hrs,Power,DC Power,DC Breaker Fault|Tripped DCDB Breaker,"FSE DAVID CONFIRMED TRIPPED OFF LIB BREAKER, IT WAS RESET_x000D_
DL:435_x000D_
GRH:12480",Incident,Platinum COLO,Silver,NORTH EAST,28449271_2024-07-05 15:26:00
28447800,Closed,Major,SITE DOWN@KN0106,KN0106,I-ENG,402493,Kano 4,Usman Shaibu,05/07/2024 14:00,05/07/2024 14:25,24.999999997671694,0.4166666666278615,<2hrs,Power,DG Fault,DG Coolant low,"FSE UMARU  CONFIRMED HIGH TEMP ON DG DUE TO LOW WATER LEVEL IN RADIATOR, RADIATOR FLUSHED AND WATER WAS ADDED_x000D_
DL:1271_x000D_
GRH:12496",Incident,Platinum COLO,Silver,NORTH EAST,28447800_2024-07-05 14:00:00
28446711,Closed,Major,SITE DOWN@KN0005,KN0005,I-ENG,402404,Kano 2,Usman Shaibu,05/07/2024 13:26,05/07/2024 14:00,34.00000001,0.566666667,<2hrs,Power,DG Fault,Faulty Priming Pump,"FSE DANIEL CONFIRMED FAULTY INJECTOR PUMP, IT WAS WORKED ON_x000D_
DL:341_x000D_
GRH:15183",Incident,Platinum COLO,Gold,NORTH EAST,28446711_2024-07-05 13:26:00
28448241,Closed,Major,SITE DOWN @ KD0914,KD0914,I-ENG,409168,Kachia Road,Emmanuel Okolo,05/07/2024 12:57,05/07/2024 15:12,135.0,2.25,2hrs - 4hrs,Power,DG Fault,Weak/Faulty LABs,"WEAK DG BATTERY, EXTERNAL BATTERY WAS USED TO RESTORE SITE (326L), (RH 5867)",Incident,Silver,Silver,NORTH WEST,28448241_2024-07-05 12:57:00
28445744,Closed,Major,SITE DOWN@KN0892,KN0892,I-ENG,627519,Kano 2,Usman Shaibu,05/07/2024 12:45,05/07/2024 14:00,75.00000000349246,1.2500000000582077,<2hrs,Power,DG Fault,Faulty Charging Alternator,"FSE DANIEL CONFIRMED FAULTY CHARGING ALTERNATOR, IT WAS WORKED ON_x000D_
DL:343_x000D_
GRH:5494",Incident,Silver,Silver,NORTH EAST,28445744_2024-07-05 12:45:00
28442570,Closed,Major,SITE DOWN@KN0372,KN0372,I-ENG,402571,Kano 4,Usman Shaibu,05/07/2024 10:49,05/07/2024 11:15,26.000000000931323,0.4333333333488554,<2hrs,Power,DG Fault,Faulty Priming Pump,"FSE UMARU  CONFIRMED FAULTY INJECTOR PUMP, IT WAS WORKED ON _x000D_
DL:390_x000D_
GRH:6818",Incident,Platinum COLO,Silver,NORTH EAST,28442570_2024-07-05 10:49:00
28441730,Closed,Major,SITE DOWN @ KG0052,KG0052,I-ENG,402352,Lokoja,Uche Obasi,05/07/2024 10:32,05/07/2024 11:22,50.000000005820766,0.8333333334303461,<2hrs,Power,Fuel Outage,Low Fuel,"LOW DIESEL AT SITE, DIESEL WAS TOPPED AND DG POWERED, DL : 337 , RH : 11426",Incident,Silver,Silver,NORTH WEST,28441730_2024-07-05 10:32:00
28442836,Closed,Major,SITE DOWN@NI0710,NI0710,I-ENG,629779,Suleja,Yusuf Abdullahi,05/07/2024 08:50,05/07/2024 12:00,190.00000000116407,3.166666666686069,2hrs - 4hrs,Power,DG Fault,DG Fuel Filter,"RS RALP CONFIRMED WATER MIXED WITH DIESEL, IT WAS SEPARATED_x000D_
DL:883_x000D_
GRH:1473",Incident,Silver,Silver,NORTH WEST,28442836_2024-07-05 08:50:00
28439158,Closed,Major,SITE DOWN@KN1818,KN1818,I-ENG,406909,Kano 2,Usman Shaibu,05/07/2024 08:45,05/07/2024 09:30,45.0,0.75,<2hrs,Power,DC Power,Rectifier Fault,"FSE DANIEL CONFIRMED FAULTY RECTIFIER CSU, IT WAS WORKED ON PENDING REPLACMENT_x000D_
DL:1258_x000D_
GHR:12547",Incident,Platinum COLO,Silver,NORTH EAST,28439158_2024-07-05 08:45:00
28439011,Closed,Major,SITE DOWN@KN0889,KN0889,I-ENG,627219,Kano 4,Usman Shaibu,05/07/2024 08:45,05/07/2024 09:28,42.99999999348074,0.7166666665580124,<2hrs,Power,DG Fault,AVR Fault,"FSE UMARU CONFIRMED FAULTY AVR, IT WAS BYPASS_x000D_
DL:1467_x000D_
GRH:8780",Incident,Platinum COLO,Silver,NORTH EAST,28439011_2024-07-05 08:45:00
28439086,Closed,Major,SITE DOWN@ZM0369,ZM0369,I-ENG,409177,Gusau,Ibrahim Lawan,05/07/2024 08:30,05/07/2024 08:35,5.000000005820766,0.083333333,<2hrs,Power,DG Fault,Radiator Leakages,"FSE SAMUEL FAULTY RADIATOR, IT WAS REPLACED_x000D_
DL:331_x000D_
GRH:20310",Incident,Silver,Silver,NORTH WEST,28439086_2024-07-05 08:30:00
28438451,Closed,Major,SITE DOWN@NI0512,NI0512,I-ENG,408301,Minna 2,Yusuf Abdullahi,05/07/2024 08:21,05/07/2024 08:58,37.00000000535511,0.6166666667559184,<2hrs,Power,DG Fault,Faulty Priming Pump,"FSE CHIROMA CONFIRMED FAULTY INJECTOR PUMP, IT WAS WORKED ON_x000D_
DL:451_x000D_
GHR:21045",Incident,Platinum COLO,Silver,NORTH WEST,28438451_2024-07-05 08:21:00
28439337,Closed,Major,SITE DOWN @ KG0087+2SUBS,KG0087,I-ENG,402371,Lokoja,Uche Obasi,05/07/2024 08:11,05/07/2024 09:48,97.00000000186265,1.6166666666977108,<2hrs,Power,Fuel Outage,Low Fuel,"LOW DIESEL AT SITE, DIESEL WAS TOPPED AND DG POWERED, DL : 236 , RH : 14169",Incident,Platinum,Platinum,NORTH WEST,28439337_2024-07-05 08:11:00
28437362,Closed,Major,SITE DOWN NI0051,NI0051,I-ENG,403440,Minna 2,Yusuf Abdullahi,05/07/2024 07:03,05/07/2024 09:22,139.00000000256114,2.3166666667093523,2hrs - 4hrs,Power,DG Fault,DG Coolant low,"FSE CHIROMA CONFIRMED HIGH TEMP ON DG DUE TO LOW WATER LEVEL IN RADIATOR, RADIATOR FLUSHED AND WATER WAS ADDED_x000D_
DL:627_x000D_
GHR:15871",Incident,Silver,Silver,NORTH WEST,28437362_2024-07-05 07:03:00
28437186,Closed,Major,SITE DOWN AT KG0391,KG0391,I-ENG,408209,Okene,Uche Obasi,05/07/2024 06:50,05/07/2024 16:16,566.0000000009313,9.433333333348855,>4hrs,Power,DG Fault,Generator Fault,"DG LOSS COMPRESSION, MDG WAS DEPLOYED TO SITE  DL : 177 , RH : 17115",Incident,Platinum COLO,Silver,NORTH WEST,28437186_2024-07-05 06:50:00
28436987,Closed,Major,SITE DOWN AT KN0087,KN0087,I-ENG,402484,Rano,Usman Shaibu,05/07/2024 06:44,05/07/2024 07:53,69.00000000488944,1.1500000000814907,<2hrs,Power,DG Fault,DG Fuel Filter,"FSE RICHARD CONFIRMED WATER MIXED WITH DIESEL, IT WAS SEPARATED AND DG POWERED_x000D_
DL:938_x000D_
GRH:8160",Incident,Silver,Silver,NORTH EAST,28436987_2024-07-05 06:44:00
28437221,Closed,Major,SITE DOWN AT KG0013,KG0013,I-ENG,402317,Okene,Uche Obasi,05/07/2024 06:31,05/07/2024 08:17,105.99999999976716,1.7666666666627862,<2hrs,Power,Fuel Outage,Low Fuel,"LOW DIESEL AT SITE, DIESEL WAS TOPPED AND DG POWERED, DL : 254 , RH : 11143",Incident,Silver,Silver,NORTH WEST,28437221_2024-07-05 06:31:00
28436359,Closed,Major,SITE DOWN AT KB4071,KB4071,I-ENG,405298,Kebbi Metro,John  Adejo,05/07/2024 06:16,05/07/2024 07:40,84.00000000139698,1.400000000023283,<2hrs,Power,DG Fault,Generator Fault,"DG MAJOR FAULT, MDG WAS POWERED",Incident,Silver,Silver,NORTH WEST,28436359_2024-07-05 06:16:00
28436157,Closed,Major,SITE DOWN AT SK0436,SK0436,I-ENG,626838,Sokoto 2,John  Adejo,05/07/2024 05:47,05/07/2024 06:42,55.00000000116415,0.9166666666860692,<2hrs,Power,DG Fault,DG Coolant low,"LOW COOLANT LEVEL IN RADIATOR, RADIATOR FLUSHED AND COOLANT ADDED DL:475L, HR:200",Incident,Silver,Silver,NORTH WEST,28436157_2024-07-05 05:47:00
28435684,Closed,Major,SITE DOWN AT KG0045,KG0045,I-ENG,402347,Okene,Uche Obasi,05/07/2024 05:47,05/07/2024 06:00,13.00000000046566,0.2166666666744277,<2hrs,Power,DG Fault,Fuel System Fault,"WATER MIX WITH DIESEL WAS FILTERED OUT AND DG POWERED DL : 439 , RH : 6166",Incident,Gold,Gold,NORTH WEST,28435684_2024-07-05 05:47:00
28435644,Closed,Major,SITE DOWN AT NI0512,NI0512,I-ENG,408301,Minna 2,Yusuf Abdullahi,05/07/2024 05:40,05/07/2024 06:11,31.00000000675209,0.5166666667792015,<2hrs,Power,DG Fault,Faulty Priming Pump,FAULTY HAND PRIMER WAS SWAPPED DL 456 RH 21044,Incident,Platinum COLO,Silver,NORTH WEST,28435644_2024-07-05 05:40:00
28434730,Closed,Major,SITE DOWN AT JG0427,JG0427,I-ENG,625848,Dutse,Usman Shaibu,05/07/2024 04:14,05/07/2024 05:37,82.99999999813735,1.3833333333022892,<2hrs,Power,DG Fault,Faulty Priming Pump,FAULTY HAND PRIMER WAS SWAPPED DL 473 RH 6935,Incident,Platinum COLO,Silver,NORTH EAST,28434730_2024-07-05 04:14:00
28434665,Closed,Major,SITE DOWN AT KG0045,KG0045,I-ENG,402347,Okene,Uche Obasi,05/07/2024 03:59,05/07/2024 04:49,49.99999999534339,0.8333333332557231,<2hrs,Power,Fuel Outage,Low Fuel,"LOW DIESEL AT SITE, DIESEL WAS TOPPED AND DG POWERED, DL : 439 , RH : 6166",Incident,Gold,Gold,NORTH WEST,28434665_2024-07-05 03:59:00
28434421,Closed,Major,SITE DOWN AT KN1668,KN1668-Z,I-ENG,409723,Kano 4,Usman Shaibu,05/07/2024 03:50,05/07/2024 05:15,85.00000000465661,1.4166666667442769,<2hrs,Power,DG Fault,Faulty Priming Pump,FAULTY INJECTOR PUMP WAS WORKED ON DL 371 RH 2762,Incident,Silver,Silver,NORTH EAST,28434421_2024-07-05 03:50:00
28434640,Closed,Major,SITE DOWN AT KD0088,KD0088,I-ENG,402206,Zaria 1,Emmanuel Okolo,05/07/2024 03:26,05/07/2024 06:46,200.0000000023283,3.3333333333721384,2hrs - 4hrs,Power,DC Power,Software Fault,"FAILED RECTIFIER LVD WAS WORKED ON, RH : 3812",Incident,Silver,Silver,NORTH WEST,28434640_2024-07-05 03:26:00
