Issue Number,Alarm Severity,Status,Event Title,Airtel Site ID,ISM,ATC ID,Cluster,Regional Manager,Alarm Start Time,Alarm Cleared Time,DURATION,MTTR,MTTR RANGE,Root Cause,Specific Cause,Underlying Cause,Closing Details,Site Issue Type,ATC CLASS,AIRTEL CLASS,AIRTEL REGION,key
28528053,Closed,Major,SITE DOWN AT KD0843,KD0843,I-ENG,408487,Birnin Gwari,Emmanuel Okolo,09/07/2024 00:35,09/07/2024 01:07,31.99999999953434,0.5333333333255723,<2hrs,Power,DG Fault,DG Starter Battery Fault,"DG LOOSED BATTERY TERMINALS WERE RE-TIGHTENED, DG POWERED. DL=1182L DGRH=739",Incident,Platinum COLO,Silver,NORTH WEST,28528053_2024-07-09 00:35:00
28527377,Closed,Major,SITE DOWN AT NI0525,NI0525,I-ENG,408299,Suleja,Yusuf Abdullahi,09/07/2024 00:05,09/07/2024 00:39,34.00000001,0.566666667,<2hrs,Power,ATS Fault,Faulty DG Contactor,"DG FAULTY GAVE CONTACTOR WAS WORKED ON, DG POWERED DL=1494L DGRH=15576",Incident,Platinum COLO,Silver,NORTH WEST,28527377_2024-07-09 00:05:00
28527395,Closed,Major,SITE DOWN@AB1611,FC2371,I-ENG,627356,Lugbe,Uche Obasi,09/07/2024 00:00,09/07/2024 01:12,72.00000000419095,1.2000000000698492,<2hrs,Power,Fuel Outage,Faulty DG Contactor,"DIESEL OUTAGE, DIESEL WAS ADDED DL367L RH 3720",Incident,Platinum COLO,Silver,NORTH WEST,28527395_2024-07-09 00:00:00
28527065,Closed,Major,SITE DOWN@KG0009,KG0009,I-ENG,402280,Okene,Uche Obasi,09/07/2024 00:00,09/07/2024 00:11,11.000000004423782,0.183333333,<2hrs,Power,Fuel Outage,Low Fuel,LOW DEISEL LEVEL// DIESEL WAS TOPPED AND DG POWERED/ DIESEL ELVEL 217L RH 4753,Incident,Platinum COLO,Silver,NORTH WEST,28527065_2024-07-09 00:00:00
28521078,Closed,Major,SITE DOWN AT KG0083,KG0083,I-ENG,402367,Okene,Uche Obasi,09/07/2024 00:00,09/07/2024 00:15,14.99999999650754,0.2499999999417923,<2hrs,Power,Fuel Outage,Low Fuel,LOW DEISEL LEVEL// DIESEL WAS TOPPED AND DG POWERED/DL 306L RH 4082,Incident,Platinum,Platinum,NORTH WEST,28521078_2024-07-09 00:00:00
28580462,Closed,Major,SITE DOWN AT KD0042,KD0042,I-ENG,402160,Birnin Gwari,Emmanuel Okolo,10/07/2024 23:52,10/07/2024 23:59,7.983333334559575,0.1330555555759929,<2hrs,Power,DG Fault,DG Oil Filter,"WATER INGRESS IN FUEL SYSTEM WAS CLEARED OUT, DL 617 DGRH 18647",Incident,Silver,Silver,NORTH WEST,28580462_2024-07-10 23:52:00
28579866,Closed,Major,SITE DOWN AT KD0664,KD0664,I-ENG,408162,Abuja Road,Emmanuel Okolo,10/07/2024 23:17,10/07/2024 23:59,42.98333333339542,0.7163888888899237,<2hrs,Power,DG Fault,DG Starter Battery Fault,"DG BATTERY TERMINAL PARTIAL CONTACT. DG BATTERY TERMINALS WERE RETIGHTENED, DG POWERED",Incident,Platinum COLO,Silver,NORTH WEST,28579866_2024-07-10 23:17:00
28579544,Closed,Major,SITE DOWN AT KG0277,KG0277,I-ENG,402384,Idah,Uche Obasi,10/07/2024 22:58,10/07/2024 23:59,61.98333333,1.0330555555410683,<2hrs,Power,DG Fault,DG Fuel Filter,"BLOCKED DG  DIESEL LINE, IT LINE WAS FLUSHED AND DG RESTORED DL 290 DGRH 19493",Incident,Silver,Silver,NORTH WEST,28579544_2024-07-10 22:58:00
28579520,Closed,Major,SITE DOWN AT KG0391,KG0391,I-ENG,408209,Okene,Uche Obasi,10/07/2024 22:48,10/07/2024 23:59,71.98333333362825,1.1997222222271375,<2hrs,Power,DG Fault,Radiator Leakages,"RADIATOR LEAKAGE WAS WORKED ON , WATER TOPPED AND DG POWERED DL 1387 DGRH 17134",Incident,Platinum COLO,Silver,NORTH WEST,28579520_2024-07-10 22:48:00
28579396,Closed,Major,SITE DOWN AT KD0819,KD0819,I-ENG,408157,Abuja Road,Emmanuel Okolo,10/07/2024 22:32,10/07/2024 23:59,87.98333333339542,1.4663888888899237,<2hrs,Power,DG Fault,DG Starter Battery Fault,"FLAT DG BATTERY , EXTERNAL BATTERY WAS USED TO POWER DG DL 1017 DGRH 20005",Incident,Platinum COLO,Silver,NORTH WEST,28579396_2024-07-10 22:32:00
28581260,Closed,Major,SITE DOWN AT KN2049 (MTN),KN2049,I-ENG,406553,Hotoro,Usman Shaibu,10/07/2024 22:01,10/07/2024 23:20,78.99999999557622,1.316666666592937,<2hrs,Power,DG Fault,DG Hard Start,"Sync failure from hybrid to dg due to failed to start alarm, alarm was cleared and dg powered",Incident,Silver,Silver,NORTH WEST,28581260_2024-07-10 22:01:00
28578565,Closed,Major,SITE DOWN AT KG0081,KG0081,I-ENG,402366,Lokoja,Uche Obasi,10/07/2024 21:57,10/07/2024 22:04,7.000000001862645,0.1166666666977107,<2hrs,Power,ATS Fault,Faulty DG Contactor,"FAULTY GAVE CONTACTOR  WAS  RESET,  DG POWERED DL 273L DGRH 14687",Incident,Platinum,Platinum,NORTH WEST,28578565_2024-07-10 21:57:00
28578670,Closed,Major,SITE DOWN AT KD0846,KD0846,I-ENG,408154,Kafanchan 2,Emmanuel Okolo,10/07/2024 21:47,10/07/2024 23:59,132.98333333339542,2.216388888889924,2hrs - 4hrs,Power,DG Fault,Radiator Leakages,"RADIATOR LEAKAGE WAS WORKED ON , WATER TOPPED AND DG POWERED DL 2014 DGRH 19240",Incident,Platinum COLO,Silver,NORTH WEST,28578670_2024-07-10 21:47:00
28577934,Closed,Major,SITE DOWN@KN0075,KN0075,I-ENG,402472,Rano,Usman Shaibu,10/07/2024 20:43,10/07/2024 21:12,29.00000000023283,0.4833333333372138,<2hrs,Power,DG Fault,DG Hard Start,"SYNC FAILURE  FROM HYBRID TO DG DUE TO DG FAILED TO START ,ALARM CLEARED DG POWERED_x000D_
DL  4158  RH  6212",Incident,Platinum,Platinum,NORTH EAST,28577934_2024-07-10 20:43:00
28581286,Closed,Major,SITE DOWN@KN0067_MTN,KN0067,I-ENG,402464,Hotoro,Usman Shaibu,10/07/2024 20:39,10/07/2024 20:50,10.999999993946403,0.183333333,<2hrs,Power,DG Fault,DG Hard Start,"HYBRID TO DG  SYNC FAILURE DUE TO DG FAILED TO START ALARM, ALARM WAS CLEARED AND DG POWERED",Incident,Platinum COLO,Silver,NORTH EAST,28581286_2024-07-10 20:39:00
28578047,Closed,Major,SITE DOWN AT KD1039,KD1039,I-ENG,627482,Kachia Road,Emmanuel Okolo,10/07/2024 20:37,10/07/2024 22:45,127.99999999813735,2.133333333302289,2hrs - 4hrs,Power,ATS Fault,Faulty DG Contactor,"FAULTY GAVE CONTACTOR  WAS  RESET,  DG POWERED",Incident,Silver,Silver,NORTH WEST,28578047_2024-07-10 20:37:00
28576448,Closed,Major,SITE DOWN AT KG0298,KG0298,I-ENG,402391,Idah,Uche Obasi,10/07/2024 19:44,10/07/2024 20:19,34.99999999883585,0.5833333333139308,<2hrs,Power,Fuel Outage,Low Fuel,"LOW DIESEL AT SITE, DIESEL WAS TOPPED AND DG POWERED DL 1143 DGRH 20509",Incident,Silver,Silver,NORTH WEST,28576448_2024-07-10 19:44:00
28576396,Closed,Major,SITE DOWN AT FC5975,FC5975,I-ENG,405170,Apo,Uche Obasi,10/07/2024 19:43,10/07/2024 21:17,94.00000000256114,1.5666666667093525,<2hrs,Power,DG Fault,Hybrid Fault,"HYBRID  SYNC FAILURE DUE TO DG FAIL TO START ALARM, IT WAS CLEARED AND DG POWERED",Incident,Platinum COLO,Silver,NORTH WEST,28576396_2024-07-10 19:43:00
28576354,Closed,Major,SITE DOWN AT AB1214,AB1214,I-ENG,408102,Apo,Uche Obasi,10/07/2024 19:14,10/07/2024 19:53,39.00000000139698,0.6500000000232831,<2hrs,Power,DG Fault,DG Hard Start,"DG FAILED TO START ALARM, ALARM WAS CLEARED AND DG POWERED",Incident,Silver,Silver,NORTH WEST,28576354_2024-07-10 19:14:00
28573639,Closed,Major,SITE DOWN AT KN0032,KN0032,I-ENG,402430,Kano 4,Usman Shaibu,10/07/2024 16:32,10/07/2024 16:52,20.000000002328303,0.3333333333721384,<2hrs,Power,DG Fault,Cylinder Head Gasket Fault,FAULTY TOP CYLINDER WAS REPLACED DL 1083 RH 13967,Incident,Gold,Gold,NORTH EAST,28573639_2024-07-10 16:32:00
28571699,Closed,Major,SITE DOWN AT NI0658,NI0658,I-ENG,627589,Minna 1,Yusuf Abdullahi,10/07/2024 15:37,10/07/2024 16:33,56.00000000442378,0.933333333,<2hrs,Power,DG Fault,DG Coolant low,"DG HIGH TEMP. DUE TO LOW WATER IN THE RADIATOR, WATER WAS TOPPED DL 860 RH 9154",Incident,Silver,Silver,NORTH WEST,28571699_2024-07-10 15:37:00
28571845,Closed,Major,SITE DOWN AT KG0464,KG0464,I-ENG,406596,Ayangba,Uche Obasi,10/07/2024 15:04,10/07/2024 15:57,52.999999994644895,0.8833333332440816,<2hrs,Power,DG Fault,DG Hard Start,FAULTY STARTER RELAY WAS WORKED ON,Incident,Platinum COLO,Silver,NORTH WEST,28571845_2024-07-10 15:04:00
28571662,Closed,Major,SITE DOWN AT KB0445,KB0445,I-ENG,627899,Yauri,John  Adejo,10/07/2024 14:57,10/07/2024 16:31,94.00000000256114,1.5666666667093525,<2hrs,Power,DG Fault,DG In stop Mode,"DG HYBRID SYNCHRONIZATION FAILURE ALARM FROM BATTERY TO DG WAS CLEARED, DG POWERED. DL=557L DGRH=5339",Incident,Silver,Silver,NORTH WEST,28571662_2024-07-10 14:57:00
28568944,Closed,Major,SITE DOWN AT AB0036,AB0036,I-ENG,400026,JAHI/KUBWA RD,Uche Obasi,10/07/2024 13:50,10/07/2024 14:40,49.99999999534339,0.8333333332557231,<2hrs,Power,DG Fault,DG Hard Start,"DG FAILED TO START ALARM, ALARM WAS CLEARED AND DG POWERED",Incident,Platinum COLO,Platinum,NORTH WEST,28568944_2024-07-10 13:50:00
28566782,Closed,Major,SITE DOWN AT KD1052,KD1052,I-ENG,627478,Abuja Road,Emmanuel Okolo,10/07/2024 12:07,10/07/2024 13:48,100.9999999939464,1.683333333,<2hrs,Power,DG Fault,DG In stop Mode,UNDER FREQUENCY ALARM WAS ADJUSTED AND DG POWERED / DL 336L DGRH 6620,Incident,Silver,Silver,NORTH WEST,28566782_2024-07-10 12:07:00
28563249,Closed,Major,SITE DOWN AT KD0848,KD0848,I-ENG,408152,Kafanchan 2,Emmanuel Okolo,10/07/2024 09:45,10/07/2024 10:31,46.00000000325963,0.7666666667209938,<2hrs,Power,DG Fault,Faulty Charging Alternator,"FAULTY CHARGING ALTERNATOR  WAS EXCITED, DL : 467 ; RH : 10102",Incident,Silver,Silver,NORTH WEST,28563249_2024-07-10 09:45:00
28560491,Closed,Major,SITE DOWN AT KG0022,KG0022,I-ENG,402326,Idah,Uche Obasi,10/07/2024 07:30,10/07/2024 10:44,194.0000000037253,3.233333333395421,2hrs - 4hrs,Power,Fuel Outage,Low Fuel,"LOW DIESEL AT SITE, DIESEL WAS TOPPED AND DG POWERED, RH : 20491",Incident,Silver,Silver,NORTH WEST,28560491_2024-07-10 07:30:00
28559121,Closed,Major,SITE DOWN@KG0391,KG0391,I-ENG,408209,Okene,Uche Obasi,10/07/2024 07:21,10/07/2024 09:24,123.00000000279395,2.050000000046566,2hrs - 4hrs,Power,Fuel Outage,Low Fuel,"LOW DIESEL AT SITE, DIESEL WAS TOPPED AND DG POWERED, DL : 1448 ; RH : 17134",Incident,Platinum COLO,Silver,NORTH WEST,28559121_2024-07-10 07:21:00
28558674,Closed,Major,SITE DOWN@AB1512,AB1512,I-ENG,406529,Kubwa,Uche Obasi,10/07/2024 07:04,10/07/2024 08:30,85.99999999743886,1.4333333332906475,<2hrs,Power,DG Fault,Generator Power Alarm,"HYBRID  SYNC FAILURE DUE TO DG FAIL TO START ALARM, IT WAS CLEARED AND DG POWERED, DL : 779 ; RH : 5274",Incident,Platinum COLO,Silver,NORTH WEST,28558674_2024-07-10 07:04:00
28558111,Closed,Major,SITE DOWN@KG0212,KG0212,I-ENG,402376,Kabba,Uche Obasi,10/07/2024 06:29,10/07/2024 09:10,161.00000000093132,2.683333333348856,2hrs - 4hrs,Power,Fuel Outage,Low Fuel,"LOW DIESEL AT SITE, DIESEL WAS TOPPED AND DG POWERED, DL : 208 ; RH : 10879",Incident,Silver,Silver,NORTH WEST,28558111_2024-07-10 06:29:00
28556081,Closed,Major,SITE DOWN@KG0277,KG0277,I-ENG,402384,Idah,Uche Obasi,10/07/2024 03:56,10/07/2024 09:48,351.9999999948777,5.866666666581295,>4hrs,Power,Fuel Outage,Low Fuel,"LOW DIESEL AT SITE, DIESEL WAS TOPPED AND DG POWERED, DL : 290 ; RH : 19480",Incident,Silver,Silver,NORTH WEST,28556081_2024-07-10 03:56:00
28555284,Closed,Major,SITE DOWN@KG0512,KG0512,I-ENG,626803,Ankpa,Uche Obasi,10/07/2024 02:42,10/07/2024 03:23,40.99999999743886,0.6833333332906477,<2hrs,Power,Fuel Outage,Low Fuel,"LOW DIESEL AT SITE, DIESEL WAS TOPPED AND DG POWERED, DISCONNECTED ON GALOOLI FOR VISIBLITY OF DIESEL LEVEL",Incident,Platinum COLO,Silver,NORTH WEST,28555284_2024-07-10 02:42:00
28555116,Closed,Major,SITE DOWN@KN0256,KN0256,I-ENG,402535,Kazaure,Usman Shaibu,10/07/2024 01:53,10/07/2024 03:03,70.0,1.1666666666278616,<2hrs,Power,DG Fault,DG Hard Start,"HYBRID  SYNC FAILURE DUE TO DG FAIL TO START ALARM, IT WAS CLEARED AND DG POWERED, DL 1044L RH 15855",Incident,Silver,Silver,NORTH EAST,28555116_2024-07-10 01:53:00
28554772,Closed,Major,SITE DOWN AT NI0340,NI0340,I-ENG,403525,Kontogora1,Yusuf Abdullahi,10/07/2024 01:29,10/07/2024 07:09,340.0000000081491,5.6666666668024845,>4hrs,Power,Planned work,Other Planned Works,"LIB OPTIMIZATION UPGRADE WAS DONE AT SITE BY ATC VENDOR. NAME OF STAFF: TUNNIS TAJU WITH THE PHONE NUMBER 07068692331, DG WAS OVERLOAD AND THE LOAD WAS ADJUSTED",Planned Work,Silver,Silver,NORTH WEST,28554772_2024-07-10 01:29:00
28554498,Closed,Major,SITE DOWN AT KD0056,KD0056,I-ENG,402174,Kafanchan 2,Emmanuel Okolo,10/07/2024 01:27,10/07/2024 03:29,121.99999999953434,2.0333333333255723,2hrs - 4hrs,Power,DG Fault,AC Breaker Fault|Tripped DG Circuit Breaker,FAULTY DG LOAD BREAKER WAS REPLACED. DL=N/A DGRH=N/A,Incident,Gold,Gold,NORTH WEST,28554498_2024-07-10 01:27:00
28554466,Closed,Major,SITE DOWN AT NI0300,NI0300,I-ENG,403502,Suleja,Yusuf Abdullahi,10/07/2024 01:21,10/07/2024 07:42,380.99999999511056,6.349999999918509,>4hrs,Power,Fuel Outage,Emergency Button Fault,"DIESEL OUTAGE, DIESEL WAS ADDED, DL:296, G/HR:7421",Incident,Platinum COLO,Silver,NORTH WEST,28554466_2024-07-10 01:21:00
28554435,Closed,Major,SITE DOWN AT KD1099,KD1099,I-ENG,405051,Kaduna Town,Emmanuel Okolo,10/07/2024 00:59,10/07/2024 03:46,166.99999999953434,2.7833333333255723,2hrs - 4hrs,Power,DC Power,Rectifier Fault,FROZEN RECTIFIER CSU WAS RESET,Incident,Silver,Silver,NORTH WEST,28554435_2024-07-10 00:59:00
28551155,Closed,Major,SITE DOWN@KN0032,KN0032,I-ENG,402430,Kano 4,Usman Shaibu,10/07/2024 00:00,10/07/2024 01:00,59.99999999650754,0.9999999999417925,<2hrs,Power,DG Fault,Cylinder Head Gasket Fault,BURNT TOP CYLINDER GASKET WAS REPLACED AND DG POWERED/DL 1103 RH 13959,Incident,Gold,Gold,NORTH EAST,28551155_2024-07-10 00:00:00
28551915,Closed,Major,SITE DOWN@KG0553,KG0553,I-ENG,405303,Idah,Uche Obasi,10/07/2024 00:00,10/07/2024 08:53,532.9999999981374,8.883333333,>4hrs,Power,Fuel Outage,Low Fuel,"LOW DIESEL AT SITE, DIESEL WAS TOPPED AND DG POWERED, DL : 269 ; RH : 8269",Incident,Silver,Silver,NORTH WEST,28551915_2024-07-10 00:00:00
28550899,Closed,Major,SITE DOWN@KG0549,KG0549,I-ENG,408604,Idah,Uche Obasi,10/07/2024 00:00,10/07/2024 08:58,538.0000000039581,8.966666666732635,>4hrs,Power,Fuel Outage,Low Fuel,"LOW DIESEL AT SITE, DIESEL WAS TOPPED AND DG POWERED, DL : 403 ; RH : 8687",Incident,Silver,Silver,NORTH WEST,28550899_2024-07-10 00:00:00
28607780,Closed,Major,SITE DOWN AT KG0277,KG0277,I-ENG,402384,Idah,Uche Obasi,11/07/2024 22:51,11/07/2024 23:32,41.00000000791624,0.6833333334652707,<2hrs,Power,Fuel Outage,Low Fuel,LOW DISEAL LEVEL AND DISEAL WAS TOPPED UP AND DG POWERED DL 290L DGRH 19512,Incident,Silver,Silver,NORTH WEST,28607780_2024-07-11 22:51:00
28605903,Closed,Major,SITE DOWN AT KG0005,KG0005,I-ENG,402309,Kabba,Uche Obasi,11/07/2024 20:20,11/07/2024 21:12,52.000000001862645,0.8666666666977108,<2hrs,Power,Fuel Outage,Low Fuel,LOW DISEAL LEVEL AND DISEAL WAS TOPPED UP AND DG POWERED DL 235L DGRH 18367,Incident,Platinum,Platinum,NORTH WEST,28605903_2024-07-11 20:20:00
28605655,Closed,Major,SITE DOWN AT FC2390,FC2390-Z,I-ENG,409554,CBD,Uche Obasi,11/07/2024 20:12,11/07/2024 20:50,37.99999999813736,0.6333333333022892,<2hrs,Power,DG Fault,Rectifier Fault|Module Fault,"FAULTY DG MODULE  WAS WORKED ON, DG POWERED DL 178 DGRH 11495",Incident,Silver,Silver,NORTH WEST,28605655_2024-07-11 20:12:00
28605702,Closed,Major,SITE DOWN AT KG0298,KG0298,I-ENG,402391,Idah,Uche Obasi,11/07/2024 20:10,11/07/2024 20:34,23.999999994412065,0.3999999999068677,<2hrs,Power,DG Fault,DG Starter Battery Fault,DG FLAT BATTERY EXTERNAL BATTERY WAS USE TO POWER SITE DL 1139 DGRH 20511,Incident,Silver,Silver,NORTH WEST,28605702_2024-07-11 20:10:00
28600412,Closed,Major,SITE DOWN AT KD0076,KD0076,I-ENG,402194,Kafanchan 1,Emmanuel Okolo,11/07/2024 16:02,11/07/2024 16:51,48.99999999208376,0.8166666665347293,<2hrs,Power,DC Power,Software Fault,"FAULTY CSU MODULE WAS RESET, DL : 335 ; RH : 25910",Incident,Silver,Silver,NORTH WEST,28600412_2024-07-11 16:02:00
28599392,Closed,Major,SITE DOWN AT KG0277,KG0277,I-ENG,402384,Idah,Uche Obasi,11/07/2024 14:41,11/07/2024 14:56,14.99999999650754,0.2499999999417923,<2hrs,Power,Fuel Outage,Low Fuel,LOW DEISEL LEVEL// DIESEL WAS TOPPED AND DG POWERED DL : 290 ; RH : 19507,Incident,Silver,Silver,NORTH WEST,28599392_2024-07-11 14:41:00
28593249,Closed,Major,SITE DOWN AT AB1214,AB1214,I-ENG,408102,Apo,Uche Obasi,11/07/2024 10:30,11/07/2024 11:22,52.000000001862645,0.8666666666977108,<2hrs,Power,DG Fault,Generator Power Alarm,"SYNC FAILURE  FROM HYBRID TO DG DUE TO DG FAILED TO START ,ALARM CLEARED DG POWERED DL : 293 ; RH : 5003",Incident,Silver,Silver,NORTH WEST,28593249_2024-07-11 10:30:00
28590540,Closed,Major,SITE DOWN AT KG0025,KG0025,I-ENG,402282,Okene,Uche Obasi,11/07/2024 09:56,11/07/2024 10:42,45.99999999278225,0.7666666665463708,<2hrs,Power,DG Fault,Faulty DG Starter Relay,"FLAT DG BATTERY, EXTRNAL BATTERY WAS USED TO POWER SITE, DL : 677 ; RH : 8674",Incident,Platinum COLO,Silver,NORTH WEST,28590540_2024-07-11 09:56:00
28586476,Closed,Major,SITE DOWN @ KB0367,KB0367,I-ENG,408199,Koko,John  Adejo,11/07/2024 07:06,11/07/2024 10:08,182.0000000065193,3.033333333441988,2hrs - 4hrs,Power,DG Fault,Generator Fault,CUT FAN BELT WAS REPLACED DL 554 RH 5808,Incident,Silver,Silver,NORTH WEST,28586476_2024-07-11 07:06:00
28585937,Closed,Major,SITE DOWN AT AB1609,AB1609,I-ENG,628856,Lugbe,Uche Obasi,11/07/2024 06:48,11/07/2024 07:12,24.000000004889444,0.4000000000814907,<2hrs,Power,Fuel Outage,Low Fuel,LOW DEISEL LEVEL// DIESEL WAS TOPPED AND DG POWERED,Incident,Silver,Silver,NORTH WEST,28585937_2024-07-11 06:48:00
28586794,Closed,Major,SITE DOWN AT AB1684,FC5975,I-ENG,405170,Apo,Uche Obasi,11/07/2024 06:13,11/07/2024 06:46,33.00000000279397,0.5500000000465661,<2hrs,Power,Fuel Outage,Low Fuel,"LOW DIESEL AT SITE, DIESEL WAS TOPPED AND DG POWERED",Incident,Platinum COLO,Silver,NORTH WEST,28586794_2024-07-11 06:13:00
28586252,Closed,Major,SITE DOWN AT KD0926,KD0926,I-ENG,626694,Kachia Road,Emmanuel Okolo,11/07/2024 06:05,11/07/2024 07:21,76.00000000675209,1.2666666667792017,<2hrs,Power,DG Fault,DG Starter Battery Fault,"FLAT DG BATTERY , EXTERNAL BATTERY WAS USED TO POWER DG DL654 DGRH 6036",Incident,Silver,Silver,NORTH WEST,28586252_2024-07-11 06:05:00
28584786,Closed,Major,SITE DOWN AT KD0245,KD0245,I-ENG,408173,Zaria 1,Emmanuel Okolo,11/07/2024 04:29,11/07/2024 05:54,85.00000000465661,1.4166666667442769,<2hrs,Power,DG Fault,Water Pump Fault,FAULTY  INJECTOR PUMP WAS SERVICED DL 409 DGRH 13619,Incident,Silver,Silver,NORTH WEST,28584786_2024-07-11 04:29:00
28582677,Closed,Major,SITE DOWN@AB0657,AB0657,I-ENG,628466,JAHI/KUBWA RD,Uche Obasi,11/07/2024 02:29,11/07/2024 06:56,267.0000000006985,4.4500000000116415,>4hrs,Power,DG Fault,DG Hard Start,"DG FAILED TO START ALARM, ALARM WAS CLEARED AND DG POWERED",Incident,Silver,Silver,NORTH WEST,28582677_2024-07-11 02:29:00
28582694,Closed,Major,SITE DOWN AT KD1046,KD1046,I-ENG,627810,Kafanchan 1,Emmanuel Okolo,11/07/2024 02:25,11/07/2024 06:26,240.9999999997672,4.016666666662786,>4hrs,Power,DG Fault,DG Coolant low,"LOW WATER IN RADIATOR, WATER WAS ADDED AND DG POWERED DL 558 DGRH 5269",Incident,Silver,Silver,NORTH WEST,28582694_2024-07-11 02:25:00
28581898,Closed,Major,SITE DOWN AT NI0281,NI0281,I-ENG,403494,Minna 2,Yusuf Abdullahi,11/07/2024 01:56,11/07/2024 08:00,364.00000000256114,6.066666666709352,>4hrs,Power,DG Fault,DG Oil,"TEAM CONFIRMED HIGH RISK AREA/  LOW OIL PRESSURE, OIL WAS TOPPED DL 4096 RH 6221",Incident,Silver,Silver,NORTH WEST,28581898_2024-07-11 01:56:00
28582721,Closed,Major,SITE DOWN AT AB1214,AB1214,I-ENG,408102,Apo,Uche Obasi,11/07/2024 01:50,11/07/2024 05:44,233.99999999790447,3.8999999999650754,2hrs - 4hrs,Power,DG Fault,DG Overheating,"HYBRID SYNC. FAILURE DUE TO DG HIGH TEMPRAURE , ALARM WAS CLEARED DG POWERED DL 249 DGRH 4996",Incident,Silver,Silver,NORTH WEST,28582721_2024-07-11 01:50:00
28581746,Closed,Major,SITE DOWN AT NI0223,NI0223,I-ENG,406684,Minna 1,Yusuf Abdullahi,11/07/2024 01:48,11/07/2024 05:28,220.0000000046566,3.666666666744277,2hrs - 4hrs,Power,DG Fault,DG Panel Fault,"FAULTY DG MODULE WAS WORKED ON_x000D_
DL  424  RH 5114",Incident,Silver,Silver,NORTH WEST,28581746_2024-07-11 01:48:00
28581130,Closed,Major,SITE DOWN AT KD1064,KD1064,I-ENG,627487,Pambegwa,Emmanuel Okolo,11/07/2024 00:38,11/07/2024 06:36,358.0000000039581,5.966666666732635,>4hrs,Power,DG Fault,DG Coolant low,LOW WATER COOLANT; COOLANT WAS ADDED AND DG POWERED SITE DISCONNECTED,Incident,Silver,Silver,NORTH WEST,28581130_2024-07-11 00:38:00
28580462,Closed,Major,SITE DOWN AT KD0042,KD0042,I-ENG,402160,Birnin Gwari,Emmanuel Okolo,11/07/2024 00:00,11/07/2024 02:36,155.99999999511056,2.5999999999185093,2hrs - 4hrs,Power,DG Fault,DG Oil Filter,"WATER INGRESS IN FUEL SYSTEM WAS CLEARED OUT, DL 617 DGRH 18647",Incident,Silver,Silver,NORTH WEST,28580462_2024-07-11 00:00:00
28579866,Closed,Major,SITE DOWN AT KD0664,KD0664,I-ENG,408162,Abuja Road,Emmanuel Okolo,11/07/2024 00:00,11/07/2024 01:30,90.0,1.5,<2hrs,Power,DG Fault,DG Starter Battery Fault,"DG BATTERY TERMINAL PARTIAL CONTACT. DG BATTERY TERMINALS WERE RETIGHTENED, DG POWERED",Incident,Platinum COLO,Silver,NORTH WEST,28579866_2024-07-11 00:00:00
28579520,Closed,Major,SITE DOWN AT KG0391,KG0391,I-ENG,408209,Okene,Uche Obasi,11/07/2024 00:00,11/07/2024 00:13,13.00000000046566,0.2166666666744277,<2hrs,Power,DG Fault,Radiator Leakages,"RADIATOR LEAKAGE WAS WORKED ON , WATER TOPPED AND DG POWERED DL 1387 DGRH 17134",Incident,Platinum COLO,Silver,NORTH WEST,28579520_2024-07-11 00:00:00
28579396,Closed,Major,SITE DOWN AT KD0819,KD0819,I-ENG,408157,Abuja Road,Emmanuel Okolo,11/07/2024 00:00,11/07/2024 00:26,26.000000000931323,0.4333333333488554,<2hrs,Power,DG Fault,DG Starter Battery Fault,"FLAT DG BATTERY , EXTERNAL BATTERY WAS USED TO POWER DG DL 1017 DGRH 20005",Incident,Platinum COLO,Silver,NORTH WEST,28579396_2024-07-11 00:00:00
28578670,Closed,Major,SITE DOWN AT KD0846,KD0846,I-ENG,408154,Kafanchan 2,Emmanuel Okolo,11/07/2024 00:00,11/07/2024 00:15,14.99999999650754,0.2499999999417923,<2hrs,Power,DG Fault,Radiator Leakages,"RADIATOR LEAKAGE WAS WORKED ON , WATER TOPPED AND DG POWERED DL 2014 DGRH 19240",Incident,Platinum COLO,Silver,NORTH WEST,28578670_2024-07-11 00:00:00
28637830,Closed,Major,SITE DOWN AT SK0414,SK0414,I-ENG,409312,Jega,John  Adejo,12/07/2024 23:12,12/07/2024 23:59,47.98333332873881,0.7997222221456468,<2hrs,Power,DG Fault,Generator Failure,"DG MAJOR FAUT, SITE POWERED ON BUB",Incident,Platinum COLO,Silver,NORTH WEST,28637830_2024-07-12 23:12:00
28637407,Closed,Major,SITE DOWN AT KB0349,KB0349,I-ENG,405382,Jega,John  Adejo,12/07/2024 22:50,12/07/2024 23:13,23.00000000162981,0.3833333333604969,<2hrs,Power,DC Power,DC Breaker Fault|Overloaded DC Breaker,BURNT CIRCUIT BREAKER WAS REPLACED DL 630 RH 5728,Incident,Platinum COLO,Silver,NORTH WEST,28637407_2024-07-12 22:50:00
28635668,Closed,Major,SITE DOWN AT KG0066,KG0066,I-ENG,402363,Kabba,Uche Obasi,12/07/2024 20:16,12/07/2024 21:20,63.99999999906868,1.0666666666511446,<2hrs,Power,Fuel Outage,Low Fuel,"LOW DIESEL AT SITE, DIESEL WAS TOPPED AND DG POWERED, DL : 386 ; RH : 9831",Incident,Silver,Silver,NORTH WEST,28635668_2024-07-12 20:16:00
28635642,Closed,Major,SITE DOWN AT AB1344,AB1344,I-ENG,627454,"G/Lada
",Uche Obasi,12/07/2024 19:45,12/07/2024 21:43,118.00000000745058,1.966666666790843,<2hrs,Power,DG Fault,Generator Power Alarm,"SYNC FAILURE  FROM HYBRID TO DG DUE TO DG FAILED TO START ,ALARM CLEARED DG POWERED DL : 399 ; RH : 4893",Incident,Silver,Silver,NORTH WEST,28635642_2024-07-12 19:45:00
28634681,Closed,Major,SITE DOWN @ FC2390- MTN,FC2390-Z,I-ENG,409554,CBD,Uche Obasi,12/07/2024 19:20,12/07/2024 20:15,55.00000000116415,0.9166666666860692,<2hrs,Power,DG Fault,Generator Power Alarm,FAULTY DG MODULE WAS WORKED ON,Incident,Silver,Silver,NORTH WEST,28634681_2024-07-12 19:20:00
28635194,Closed,Major,SITE DOWN AT KN0159 (MTN),KN0159-Z,I-ENG,409721,Kano 6,Usman Shaibu,12/07/2024 18:46,12/07/2024 20:45,119.00000000023284,1.9833333333372136,<2hrs,Power,DG Fault,DG Coolant low,"DG HIGH TEMP DUE TO LOW WATER IN THE RADIATOR, WATER WAS TOPPED DL 1188 RH 6010",Incident,Silver,Silver,NORTH WEST,28635194_2024-07-12 18:46:00
28633485,Closed,Major,SITE DOWN@NI0518,NI0518,I-ENG,408307,Kontogora1,Yusuf Abdullahi,12/07/2024 18:25,12/07/2024 19:42,76.99999999953434,1.2833333333255723,<2hrs,Power,DG Fault,Faulty Battery,"DG FLAT BATTERY, EXTERNAL BATTERY WAS USED TO POWER SITE DL 1442 RH 17782",Incident,Platinum COLO,Silver,NORTH WEST,28633485_2024-07-12 18:25:00
28633180,Closed,Major,SITE DOWN @ KD0423,KD0423,I-ENG,402277,Birnin Gwari,Emmanuel Okolo,12/07/2024 17:47,12/07/2024 18:38,50.999999998603016,0.8499999999767169,<2hrs,Power,DC Power,DC Cable Fault|Burnt DC Cable,"BURNT BTS POWER CABLE WAS REPLACED DL 2689, RH 12180",Incident,Platinum COLO,Silver,NORTH WEST,28633180_2024-07-12 17:47:00
28632566,Closed,Major,SITE DOWN@KN0266_MTN,KN0266-Z,I-ENG,409720,Hotoro,Usman Shaibu,12/07/2024 17:00,12/07/2024 17:20,19.999999991850927,0.3333333331975154,<2hrs,Power,DC Power,AC Breaker Fault|Tripped ACDB Breaker,"FSE ISAAC CONFIRMED TRIPPED OFF DCDB BREAKER, IT WAS REPLACED_x000D_
DL:585_x000D_
GRH:5320",Incident,Platinum COLO,Silver,NORTH EAST,28632566_2024-07-12 17:00:00
28630929,Closed,Major,SITE DOWN @ AB0059,AB0059,I-ENG,400043,CBD,Uche Obasi,12/07/2024 16:24,12/07/2024 17:18,53.99999999790453,0.8999999999650754,<2hrs,Power,DG Fault,High Temperature,"HIGH TEMP ON DG DUE TO LOW WATER LEVEL IN RADIATOR, RADIATOR FLUSHED AND WATER WAS ADDED_x000D_
DL 1135, RH 1657",Incident,Platinum,Platinum,NORTH WEST,28630929_2024-07-12 16:24:00
28626422,Closed,Major,SITE DOWN@NI0016_ MTN,NI0016,I-ENG,403365,Minna 2,Yusuf Abdullahi,12/07/2024 15:45,12/07/2024 15:59,14.00000000372529,0.2333333333954215,<2hrs,Power,DC Power,Rectifier Fault,"FSE CHIROMA CONFIRMED FAULTY RECTIFIER BREAKER, IT WAS REPLACED_x000D_
DL:2596_x000D_
GRH:2180",Incident,Platinum COLO,Silver,NORTH WEST,28626422_2024-07-12 15:45:00
28630365,Closed,Major,SITE DOWN @ AB1234,AB1234,I-ENG,408104,Lugbe,Uche Obasi,12/07/2024 15:33,12/07/2024 17:29,116.00000000093132,1.933333333348856,<2hrs,Power,DG Fault,AVR Fault,"FAULTY AVR WAS EXCITED AND DG POWERED DL 740, RH 11158",Incident,Platinum COLO,Silver,NORTH WEST,28630365_2024-07-12 15:33:00
28623337,Closed,Major,SITE DOWN @ KD0595,KD0595,I-ENG,625988,Zaria 1,Emmanuel Okolo,12/07/2024 13:35,12/07/2024 15:45,130.0000000046566,2.166666666744277,2hrs - 4hrs,Power,DG Fault,DG Electric Fuel Pump,"FAULTY INJECTOR PUMP WAS WORKED ON DL 1287, RH 7676",Incident,Silver,Silver,NORTH WEST,28623337_2024-07-12 13:35:00
